{
  "schema_version": "1.0",
  "prediction_id": "lol-s-tier-2026-07-24-1048",
  "created_at": "2026-07-24T10:48:00+08:00",
  "as_of": "2026-07-24T10:48:00+08:00",
  "sport": "League of Legends",
  "mode": "daily-summary",
  "question": "深入分析台灣時間 2026-07-24 全部 S Tier League of Legends 賽事。",
  "event": {
    "event_id": "lol-s-tier-tw-2026-07-24",
    "competition": "LPL 2026 Split 3",
    "start_time": "2026-07-24T15:00:00+08:00",
    "timezone": "Asia/Taipei",
    "format": "3 x BO3",
    "participants": [
      "Anyone's Legend",
      "LGD Gaming",
      "Team WE",
      "JD Gaming",
      "EDward Gaming",
      "Bilibili Gaming"
    ]
  },
  "model_data": {
    "data_quality": {
      "completeness": 82,
      "missing": [
        "三場 Game 1 選邊尚未確認",
        "BLG 今日先發上路尚未由當場官方名單確認（7/23 使用 Wenbo，Bin 仍在 roster）",
        "未能逐場完整複盤官方全長 VOD，只取得近期賽果、局內數據、BP/版本紀錄與賽後討論",
        "LPL 當日賽事頁尚未填入 game_version；依 7/23 已完成比賽採 Patch 16.14 推估"
      ],
      "warnings": [
        "Leaguepedia/Liquipedia 將 LCP Split 3 開幕列為 7/24，但 Riot 7/13 最新官方公告寫 7/25；依官方近場公告與 bo3.gg 當日清單，今日移除 LCP 兩場。",
        "bo3.gg roster 頁面部分欄位更新落後；先發判斷優先採 7/22-7/23 實際出賽名單。"
      ]
    },
    "evidence": [
      {
        "id": "sched_bo3",
        "category": "schedule",
        "claim": "bo3.gg 於 7/24 當日 S-tier 清單列出 AL-LGD、WE-JDG、EDG-BLG 三場 LPL BO3，bo3 match IDs 分別為 124501、124502、124503，時間換算台灣時間為 15:00、17:00、19:00。",
        "status": "confirmed",
        "source": {
          "title": "bo3.gg LoL Match Center",
          "url": "https://bo3.gg/lol/matches/current",
          "published_at": null,
          "retrieved_at": "2026-07-24T10:48:00+08:00"
        }
      },
      {
        "id": "sched_lpl_lp",
        "category": "schedule",
        "claim": "Liquipedia LPL Split 3 Week 1-2 獨立列出 7/24 15:00 AL-LGD、17:00 WE-JDG、19:00 EDG-BLG，均為 UTC+8。",
        "status": "confirmed",
        "source": {
          "title": "LPL 2026 Split 3 Regular Season Week 1-2",
          "url": "https://liquipedia.net/leagueoflegends/LPL/2026/Split_3/Regular_Season/Week_1-2",
          "published_at": "2026-07-13",
          "retrieved_at": "2026-07-24T10:48:00+08:00"
        }
      },
      {
        "id": "sched_lcp_official",
        "category": "schedule",
        "claim": "Riot 7/13 的 LCP Split 3 最新官方公告明確寫 7/25 開幕，因此 7/24 不納入 LCP；其優先級高於仍顯示 7/24 的 Leaguepedia/Liquipedia 舊排程。",
        "status": "confirmed",
        "source": {
          "title": "LCP 2026 Split 3 Everything You Need To Know",
          "url": "https://lolesports.com/en-au/news/lcp-2026-split-3-everything-you-need-to-know",
          "published_at": "2026-07-13",
          "retrieved_at": "2026-07-24T10:48:00+08:00"
        }
      },
      {
        "id": "patch_official",
        "category": "patch",
        "claim": "Patch 26.14 buff Azir 互動、Corki、Nami、Yunara與高等級藍 Buff，nerf Jayce、Senna、Seraphine；7/23 LPL 已完成比賽使用 16.14。",
        "status": "confirmed",
        "source": {
          "title": "League of Legends Patch 26.14 Notes",
          "url": "https://www.leagueoflegends.com/en-us/news/game-updates/league-of-legends-patch-26-14-notes/",
          "published_at": "2026-07-14T18:00:00Z",
          "retrieved_at": "2026-07-24T10:48:00+08:00"
        }
      },
      {
        "id": "al_roster",
        "category": "roster",
        "claim": "AL current roster為 Flandre / Tarzan / Shanks / Hope / Kael；7/23 以此核心 2-1 擊敗 JDG。",
        "status": "confirmed",
        "source": {
          "title": "Anyone's Legend - Leaguepedia",
          "url": "https://lol.fandom.com/wiki/Anyone%27s_Legend",
          "published_at": null,
          "retrieved_at": "2026-07-24T10:48:00+08:00"
        }
      },
      {
        "id": "lgd_recent",
        "category": "form",
        "claim": "LGD 7/22 使用 Burdol / Heng / Tangyuan / Shaoye / Crisp，以 2-0 擊敗 EDG；兩局合計 41-22 擊殺、18-7 防禦塔、5-1 巴龍。",
        "status": "confirmed",
        "source": {
          "title": "LGD Gaming vs EDG summary - Games of Legends",
          "url": "https://gol.gg/game/stats/80183/page-summary/",
          "published_at": "2026-07-22",
          "retrieved_at": "2026-07-24T10:48:00+08:00"
        }
      },
      {
        "id": "al_lgd_h2h",
        "category": "h2h",
        "claim": "AL 在 6/5 同陣容、相近制度的 LPL Split 2 季後賽以 3-0 擊敗 LGD；本次為 BO3，故只作收縮先驗且權重折半。",
        "status": "confirmed",
        "source": {
          "title": "LPL Split 3 Week 1 Match AL vs LGD - Liquipedia",
          "url": "https://liquipedia.net/leagueoflegends/Match%3AID_26LPLS3RS1_0005",
          "published_at": null,
          "retrieved_at": "2026-07-24T10:48:00+08:00"
        }
      },
      {
        "id": "we_roster",
        "category": "roster",
        "claim": "WE active roster為 Cube / Monki（Tyrion 為替補打野）/ Karis / About / Erha；7/22 對 TES 使用 About 下路並以 0-2 落敗。",
        "status": "confirmed",
        "source": {
          "title": "Team WE - Leaguepedia",
          "url": "https://lol.fandom.com/wiki/Team_WE",
          "published_at": null,
          "retrieved_at": "2026-07-24T10:48:00+08:00"
        }
      },
      {
        "id": "jdg_roster",
        "category": "roster",
        "claim": "JDG active roster為 Xiaoxu / JunJia / HongQ / GALA / Vampire。",
        "status": "confirmed",
        "source": {
          "title": "JD Gaming - Leaguepedia",
          "url": "https://lol.fandom.com/wiki/JD_Gaming",
          "published_at": null,
          "retrieved_at": "2026-07-24T10:48:00+08:00"
        }
      },
      {
        "id": "jdg_recent",
        "category": "form",
        "claim": "JDG 7/23 以 1-2 不敵 AL，決勝局拖至約 56 分鐘；JunJia 在本 Split 3 三局的早期金差資料偏弱，顯示中野起手與收尾仍有不穩。",
        "status": "confirmed",
        "source": {
          "title": "JDG vs AL Post-Match Discussion",
          "url": "https://www.reddit.com/r/leagueoflegends/comments/1v4byz6/jd_gaming_vs_anyones_legend_lpl_2026_split_3/",
          "published_at": "2026-07-23",
          "retrieved_at": "2026-07-24T10:48:00+08:00"
        }
      },
      {
        "id": "we_playoffs",
        "category": "form",
        "claim": "WE 在 Split 2 季後賽曾連續以 3-0 AL、3-1 BLG 展示爆冷上限，之後又以 0-3 TES、2-3 BLG 落敗，顯示高峰很高但系列間波動大。",
        "status": "confirmed",
        "source": {
          "title": "Team WE vs JD Gaming - bo3.gg",
          "url": "https://bo3.gg/lol/matches/team-we-vs-jd-gaming-lol-24-07-2026",
          "published_at": null,
          "retrieved_at": "2026-07-24T10:48:00+08:00"
        }
      },
      {
        "id": "edg_recent",
        "category": "form",
        "claim": "EDG 7/22 使用 Zdz / Xiaohao / Bulldog / Leave / Parukia，0-2 負於 LGD；兩局合計僅 7 塔、1 巴龍且 Parukia 2/11/12，Bulldog 的版本首秀亦未穩定提供輸出結構。",
        "status": "confirmed",
        "source": {
          "title": "LGD Gaming vs EDG summary - Games of Legends",
          "url": "https://gol.gg/game/stats/80183/page-summary/",
          "published_at": "2026-07-22",
          "retrieved_at": "2026-07-24T10:48:00+08:00"
        }
      },
      {
        "id": "blg_recent",
        "category": "form",
        "claim": "BLG 7/23 使用 Wenbo / Xun / Knight / Viper / ON，以 2-1 擊敗 TT；G2 曾被 TT 用 28:34、9.8k 金差扳平，但 G3 以 27-13、8-1 塔、4-0 龍、9k 金差收束。",
        "status": "confirmed",
        "source": {
          "title": "BLG vs TT summary - Games of Legends",
          "url": "https://gol.gg/game/stats/80192/page-summary/",
          "published_at": "2026-07-23",
          "retrieved_at": "2026-07-24T10:48:00+08:00"
        }
      },
      {
        "id": "blg_edg_h2h",
        "category": "h2h",
        "claim": "BLG 6/3 在 Patch 16.10 的 Split 2 季後賽 3-0 EDG，三局僅讓 EDG 拿到 4 座塔；屬同賽區同核心的強先驗，但版本與 BLG 上路人選已有變動。",
        "status": "confirmed",
        "source": {
          "title": "EDG vs BLG game 3 - Games of Legends",
          "url": "https://gol.gg/game/stats/79119/page-game/",
          "published_at": "2026-06-03",
          "retrieved_at": "2026-07-24T10:48:00+08:00"
        }
      },
      {
        "id": "blg_ewc",
        "category": "form",
        "claim": "BLG 7/17 在 EWC Patch 26.13 BO3 以 1-2 不敵 Dplus KIA，說明其近期國際賽內容並非不可攻擊；但該賽與今日 26.14、國內對位並不完全可比。",
        "status": "confirmed",
        "source": {
          "title": "BLG vs Dplus KIA EWC Post-Match Discussion",
          "url": "https://www.reddit.com/r/leagueoflegends/comments/1uz3i6s/bilibili_gaming_vs_dplus_kia_esports_world_cup/",
          "published_at": "2026-07-17",
          "retrieved_at": "2026-07-24T10:48:00+08:00"
        }
      }
    ],
    "notes": [
      "主模型以系列賽因素建模；市場資料獨立保存，僅在機率固定後比較。",
      "所有 BO3 精確比分由逐局、Fearless Draft、選邊與局間修正情境整合；不假設每局獨立同分布。",
      "近期有效樣本主要只有各隊 Split 3 一個系列，故觸發 LoL 非補償式信心上限。"
    ]
  },
  "market_data": [
    {
      "bet_id": "stake-al-ml",
      "label": "Anyone's Legend 系列賽獨贏",
      "outcome_key": "al_win",
      "decimal_odds": 1.13,
      "book": "Stake",
      "retrieved_at": "2026-07-24T10:48:00+08:00"
    },
    {
      "bet_id": "stake-lgd-ml",
      "label": "LGD Gaming 系列賽獨贏",
      "outcome_key": "lgd_win",
      "decimal_odds": 6.0,
      "book": "Stake",
      "retrieved_at": "2026-07-24T10:48:00+08:00"
    },
    {
      "bet_id": "stake-we-ml",
      "label": "Team WE 系列賽獨贏",
      "outcome_key": "we_win",
      "decimal_odds": 3.1,
      "book": "Stake",
      "retrieved_at": "2026-07-24T10:48:00+08:00"
    },
    {
      "bet_id": "stake-jdg-ml",
      "label": "JD Gaming 系列賽獨贏",
      "outcome_key": "jdg_win",
      "decimal_odds": 1.38,
      "book": "Stake",
      "retrieved_at": "2026-07-24T10:48:00+08:00"
    },
    {
      "bet_id": "stake-edg-ml",
      "label": "EDward Gaming 系列賽獨贏",
      "outcome_key": "edg_win",
      "decimal_odds": 7.0,
      "book": "Stake",
      "retrieved_at": "2026-07-24T10:48:00+08:00"
    },
    {
      "bet_id": "stake-blg-ml",
      "label": "Bilibili Gaming 系列賽獨贏",
      "outcome_key": "blg_win",
      "decimal_odds": 1.1,
      "book": "Stake",
      "retrieved_at": "2026-07-24T10:48:00+08:00"
    }
  ]
}
